{
  "account_id": "account-credit-001",
  "relationship_id": "rel-synthetic-001",
  "legal_entity_id": "entity-bank-holdco",
  "line_of_business_id": "commercial-banking",
  "as_of": "2026-04-24T00:00:00Z",
  "cadence": "intraday",
  "currency": "USD",
  "balances": {"current": 10000000.0, "average": 9250000.0},
  "attributes": {"account_type": "commercial_credit"}
}
